{
  "$schema": "https://json-schema.org/draft/2020-12/schema",
  "title": "Portfolio Release Manifest",
  "description": "A fixed, testable combination of portfolio repository commits.",
  "type": "object",
  "additionalProperties": false,
  "required": [
    "schemaVersion",
    "release",
    "repositories"
  ],
  "properties": {
    "schemaVersion": {
      "const": 1
    },
    "release": {
      "type": "string",
      "description": "Stable portfolio release identifier.",
      "pattern": "^portfolio-v(0|[1-9][0-9]*)\\.(0|[1-9][0-9]*)\\.(0|[1-9][0-9]*)$"
    },
    "description": {
      "type": "string",
      "minLength": 1,
      "maxLength": 4000
    },
    "repositories": {
      "type": "object",
      "additionalProperties": false,
      "required": [
        "storyengine",
        "chiefAi",
        "sekretBip"
      ],
      "properties": {
        "storyengine": {
          "$ref": "#/$defs/repositoryPin"
        },
        "chiefAi": {
          "$ref": "#/$defs/repositoryPin"
        },
        "sekretBip": {
          "$ref": "#/$defs/repositoryPin"
        }
      }
    },
    "changes": {
      "type": "array",
      "maxItems": 100,
      "uniqueItems": true,
      "items": {
        "type": "string",
        "minLength": 1,
        "maxLength": 1000
      }
    }
  },
  "$defs": {
    "commitSha": {
      "type": "string",
      "description": "Full lowercase SHA-1 commit identifier.",
      "pattern": "^[0-9a-f]{40}$",
      "not": {
        "const": "0000000000000000000000000000000000000000"
      }
    },
    "repositoryPin": {
      "type": "object",
      "additionalProperties": false,
      "required": [
        "repository",
        "commit"
      ],
      "properties": {
        "repository": {
          "type": "string",
          "description": "GitHub owner/repository; verified against trusted policy.",
          "maxLength": 140,
          "pattern": "^[A-Za-z0-9][A-Za-z0-9-]*/[A-Za-z0-9_.-]+$"
        },
        "commit": {
          "$ref": "#/$defs/commitSha"
        }
      }
    }
  }
}
